commit	val_bpb	memory_gb	status	description
b0b64ff	2.6948	0.0	keep	baseline_v2 (ROE>10%, 毛利>20%, 负债<50%, 8 只)
ba93cb1	2.0375	0.0	discard	exp1: ROE>15%（夏普下降）
4bef905	2.6948	0.0	keep	exp2: 负债<50%（持平）
b46b1d1	2.6948	0.0	discard	exp3: 毛利>30%（选中 0 只）
671ff27	2.6948	0.0	keep	exp4: 调仓 3 天
69edb05	-0.3077	0.0	discard	exp5: 营收增长>0%（夏普暴跌）
8275d3e	2.1760	0.0	discard	exp6: ROE 加权（夏普下降）
bea158e	2.5984	0.0	discard	exp7: 单只 6%（夏普略降）
cbe6cd1	2.8532	0.0	keep	exp10: ROE>8%, 负债<66%（夏普 2.85，9 只）
1a8aadc	3.0075	0.0	keep	exp14: ROE>7%, 负债<90%, 无毛利（估算夏普 3.01，10 只）
492d2c2	0.8161	0.0	keep	exp15: 真实回测 7 年（夏普 0.82，年化 18.82%，9 只）
3555f6e	0.5799	0.0	discard	exp16: 波动率<35%（夏普 0.58，年化 12.88%）
HEAD	0.8045	0.0	pending	exp18: ROE>15%（夏普 0.80，年化 20.39%，回撤 -38%）
